{
  "version": "1.0.0",
  "last_updated": "2026-03-22T22:05:44.630566",
  "created_at": "2026-03-22T22:05:44.630568",
  "total_lessons": 63,
  "total_patterns": 0,
  "total_rules": 0,
  "total_topics": 0,
  "total_terms": 0,
  "total_charts": 0,
  "total_images": 0,
  "total_videos": 0,
  "embeddings_indexed": 0,
  "categories": [
    "beginners",
    "gold-mechanics",
    "market-mechanics",
    "principles",
    "psychology",
    "risk-management",
    "structure-and-liquidity",
    "tda-and-entry-models"
  ],
  "sources": [
    {
      "name": "knowledge_raw migration",
      "type": "markdown",
      "count": 63,
      "last_imported": "2026-03-22T22:05:44.630571"
    }
  ],
  "completeness_metrics": {
    "lessons_with_examples": 0,
    "lessons_with_images": 0,
    "patterns_documented": 0,
    "embeddings_coverage": 0
  },
  "quality_notes": "Initial migration from knowledge_raw/. Ready for enrichment.",
  "next_priorities": [
    "Create pattern entities from lesson content",
    "Identify and extract trading rules",
    "Add chart examples to lessons",
    "Generate embeddings for semantic search",
    "Build relationship graph"
  ]
}